<?xml version="1.0" encoding="ISO-8859-1" standalone="no"?>

<!DOCTYPE document SYSTEM '../../common/dtd/ow2.dtd'>

<document>
  <properties>
    <author email="mind@ow2.org">MIND team</author>
    <title>License Status</title>
    <filename>license.xml</filename>
    <pathtoroot>.</pathtoroot>
  </properties>

  <body>
    <s1 name="License Status">
      <p>The mindc tool-chain, the component library and the IDE are licensed 
        under the <a href="http://www.gnu.org/copyleft/lesser.html">GNU Lesser
        General Public License</a>.</p>
    </s1>
  </body>
</document>
